{
  "$schema": "http://json-schema.org/draft-07/schema#",
  "$id": "https://raw.githubusercontent.com/xai-org/grok-build/main/schemas/marketplace-index.schema.json",
  "title": "Grok Plugin Marketplace Index",
  "description": "Repo-level marketplace index. Config files: `.grok-plugin/marketplace.json` (preferred), `.grok-plugin/plugin.json`, `.claude-plugin/marketplace.json`, `.claude-plugin/plugin.json` (checked in that order; first existing file wins). Deserialized into `MarketplaceIndex`. Forward-compatible: unknown top-level keys (e.g. `$schema`, `metadata`) are ignored by serde.",
  "type": "object",
  "x-source-rev": "9b8d35b46d959c042ea9aa31cbbebbd1f0c5c527",
  "required": ["name"],
  "properties": {
    "name": {
      "type": "string",
      "description": "Marketplace display name. Required, non-optional field on `MarketplaceIndex`."
    },
    "description": {
      "type": "string",
      "description": "Marketplace description. `#[serde(default)] Option<String>`."
    },
    "owner": {
      "$ref": "#/definitions/indexOwner",
      "description": "Marketplace owner metadata. `#[serde(default)] Option<IndexOwner>`."
    },
    "plugins": {
      "type": "array",
      "default": [],
      "items": { "$ref": "#/definitions/indexEntry" },
      "description": "Indexed plugin entries. `#[serde(default)] Vec<IndexEntry>` — absent key deserializes to an empty vec."
    }
  },
  "definitions": {
    "indexOwner": {
      "type": "object",
      "description": "Marketplace owner.",
      "required": ["name"],
      "properties": {
        "name": {
          "type": "string",
          "description": "Owner display name. Required field on `IndexOwner`."
        },
        "email": {
          "type": "string",
          "description": "Owner email. `#[serde(default)] Option<String>`."
        }
      }
    },
    "indexEntry": {
      "type": "object",
      "description": "A single plugin entry in the marketplace index.",
      "required": ["name"],
      "properties": {
        "name": {
          "type": "string",
          "description": "Plugin name. Required field on `IndexEntry`."
        },
        "version": {
          "type": "string",
          "description": "Version string from index metadata. `#[serde(default)] Option<String>`."
        },
        "description": {
          "type": "string",
          "description": "Human-readable description. `#[serde(default)] Option<String>`."
        },
        "category": {
          "type": "string",
          "examples": ["development", "productivity", "design"],
          "description": "Category, e.g. \"development\", \"productivity\", \"design\". `#[serde(default)] Option<String>`."
        },
        "author": {
          "$ref": "#/definitions/indexAuthor",
          "description": "Author info. `#[serde(default)] Option<IndexAuthor>`."
        },
        "source": {
          "$ref": "#/definitions/indexSource",
          "description": "Source location within the marketplace repo. `#[serde(default)] Option<IndexSource>`, hand-written `Deserialize` accepting a string shorthand or an object."
        },
        "homepage": {
          "type": "string",
          "description": "Homepage URL. `#[serde(default)] Option<String>`."
        },
        "tags": {
          "type": "array",
          "default": [],
          "items": { "type": "string" },
          "description": "Tags/keywords. `#[serde(default)] Vec<String>`."
        },
        "keywords": {
          "type": "array",
          "default": [],
          "items": { "type": "string" },
          "description": "Matcher keywords used to associate the plugin with a user request. `#[serde(default)] Vec<String>`."
        },
        "domains": {
          "type": "array",
          "default": [],
          "items": { "type": "string" },
          "description": "Matcher domains used to associate the plugin with a user request. `#[serde(default)] Vec<String>`."
        }
      }
    },
    "indexAuthor": {
      "type": "object",
      "description": "Author in an index entry.",
      "required": ["name"],
      "properties": {
        "name": {
          "type": "string",
          "description": "Author display name. Required field on `IndexAuthor`."
        }
      }
    },
    "indexSource": {
      "description": "Source location in an index entry. Hand-written `Deserialize` (not derived) accepting either a plain string shorthand (a local relative path, e.g. \"./plugins/foo\") OR an object keyed by `type` (local sources, e.g. `{\"type\": \"local\", \"path\": \"./plugins/foo\"}`) or by the superpowers-style discriminator `source` (e.g. `{\"source\": \"url\", \"url\": \"https://...\", \"ref\": \"main\"}` or `{\"source\": \"url\", \"url\": \"https://...\", \"sha\": \"61f19...\"}`). Every object field is independently optional — the visitor tolerates any subset being absent.",
      "oneOf": [
        {
          "type": "string",
          "description": "String shorthand: interpreted as a local relative path; normalized to `{type: \"local\", path: <string>}`."
        },
        {
          "type": "object",
          "description": "Object form. No fields are required by the hand-written visitor — all keys are independently optional and default to `None` when absent.",
          "properties": {
            "type": {
              "type": "string",
              "examples": ["local", "url"],
              "description": "Source type discriminator, e.g. \"local\"."
            },
            "source": {
              "type": "string",
              "examples": ["url"],
              "description": "Superpowers-format discriminator alias for `type`, e.g. \"url\". Adopted as `type` when `type` itself is absent."
            },
            "path": {
              "type": "string",
              "description": "Local path relative to the marketplace root (for local sources), or a subdirectory within a remote repo (for URL sources)."
            },
            "url": {
              "type": "string",
              "description": "Remote git URL (used by superpowers-style marketplaces)."
            },
            "ref": {
              "type": "string",
              "description": "Git ref (branch/tag/commit) for URL sources. Maps to `git_ref`."
            },
            "sha": {
              "type": "string",
              "description": "Full pinned commit SHA for URL sources (recommended for vendor pins). Maps to `git_sha`."
            }
          }
        }
      ]
    }
  }
}
